{
  "attention": [
    {
      "batch_size": 8,
      "context_length": 16384,
      "duration_us": 270.56328
    },
    {
      "batch_size": 8,
      "context_length": 16385,
      "duration_us": 270.587928
    },
    {
      "batch_size": 8,
      "context_length": 16386,
      "duration_us": 270.587928
    },
    {
      "batch_size": 8,
      "context_length": 16387,
      "duration_us": 270.612576
    },
    {
      "batch_size": 8,
      "context_length": 16388,
      "duration_us": 270.636912
    },
    {
      "batch_size": 8,
      "context_length": 16389,
      "duration_us": 270.636912
    },
    {
      "batch_size": 8,
      "context_length": 16390,
      "duration_us": 270.66156
    },
    {
      "batch_size": 8,
      "context_length": 16391,
      "duration_us": 270.68620799999997
    }
  ],
  "expert_gemv": [
    {
      "compute_us": 1.180296,
      "gwrite_us": 0.131664,
      "read_us": 0.01404,
      "token_count": 1
    },
    {
      "compute_us": 2.359968,
      "gwrite_us": 0.262704,
      "read_us": 0.01404,
      "token_count": 2
    },
    {
      "compute_us": 3.539328,
      "gwrite_us": 0.394056,
      "read_us": 0.015288,
      "token_count": 3
    },
    {
      "compute_us": 4.719,
      "gwrite_us": 0.525096,
      "read_us": 0.015288,
      "token_count": 4
    },
    {
      "compute_us": 5.898672,
      "gwrite_us": 0.656136,
      "read_us": 0.016224,
      "token_count": 5
    },
    {
      "compute_us": 7.078344,
      "gwrite_us": 0.787176,
      "read_us": 0.016224,
      "token_count": 6
    },
    {
      "compute_us": 8.258016,
      "gwrite_us": 0.918216,
      "read_us": 0.01716,
      "token_count": 7
    },
    {
      "compute_us": 9.437688,
      "gwrite_us": 1.049256,
      "read_us": 0.01716,
      "token_count": 8
    },
    {
      "compute_us": 10.61736,
      "gwrite_us": 1.180296,
      "read_us": 0.018408,
      "token_count": 9
    },
    {
      "compute_us": 11.797032,
      "gwrite_us": 1.311336,
      "read_us": 0.018408,
      "token_count": 10
    },
    {
      "compute_us": 12.976704,
      "gwrite_us": 1.442376,
      "read_us": 0.019344,
      "token_count": 11
    },
    {
      "compute_us": 14.156376,
      "gwrite_us": 1.573416,
      "read_us": 0.019344,
      "token_count": 12
    },
    {
      "compute_us": 18.874752,
      "gwrite_us": 2.097888,
      "read_us": 0.021216,
      "token_count": 16
    },
    {
      "compute_us": 20.054424,
      "gwrite_us": 2.228928,
      "read_us": 0.022464,
      "token_count": 17
    },
    {
      "compute_us": 21.234096,
      "gwrite_us": 2.359968,
      "read_us": 0.022464,
      "token_count": 18
    },
    {
      "compute_us": 28.312128,
      "gwrite_us": 3.14652,
      "read_us": 0.025584,
      "token_count": 24
    },
    {
      "compute_us": 37.749192,
      "gwrite_us": 4.19484,
      "read_us": 0.02964,
      "token_count": 32
    },
    {
      "compute_us": 47.186568,
      "gwrite_us": 5.243472,
      "read_us": 0.033696,
      "token_count": 40
    },
    {
      "compute_us": 56.623632,
      "gwrite_us": 6.292104,
      "read_us": 0.037752,
      "token_count": 48
    },
    {
      "compute_us": 66.060696,
      "gwrite_us": 7.340736,
      "read_us": 0.041808,
      "token_count": 56
    },
    {
      "compute_us": 75.498072,
      "gwrite_us": 8.389368,
      "read_us": 0.045864,
      "token_count": 64
    }
  ],
  "metadata": {
    "extension_commit": "cycle-v0-sha256:71a9909041fbf4cc70e1da5e4f6a98508e863053b392463349129791f1d182ce",
    "hardware_config_sha256": "b9d6a5132a95cdc58e6cc0bcb2ec9aec691cb9ed19682d7cd28b1263f3783ef0",
    "ramulator_commit": "b30320bc9385b708e86b67ebb9f48858cc66d798",
    "trace_generator_sha256": "ca7d67319ca506c042306f5451395231126aff40461158e015bbd052b802c6ae",
    "units": "us"
  },
  "schema_version": 1
}
